Title,Date,Rating,Author,Summary,OCN,Pros,Cons,Verdict
HP OfficeJet Pro 8022,2020-05-18,8.3,Morten Skeldal Østergaard,Härlig allroundskrivare.,Skrivare, Många funktioner," Problem med nyanser
",Färgskärmen är tydlig och tryckkänslig. Menyerna är på svenska och det är enkelt att styra skrivaren härifrån. Det gör att skrivaren även är en galant kopiator.
Sandberg Commander Gaming Chair RGB,2020-05-13,7.9,Morten Skeldal Østergaard,Spelstol för kontoret.,Diverse, Komfortabel kontorsstol," Klen hållare för batteriet
","Som sig bör kan höjden justeras med en spak under sitsen. Även armstöden kan justeras i höjdled, men det går inte att ändra deras positioner i sidled. Ryggstödet kan fällas så långt bakåt att man närmast ligger ned. Det följer med ett par lösa kuddar som kan placeras där de behövs, till exempel bakom svanken och nacken. Tillsammans gör allt detta att vi i slutändan får en ganska behaglig kontorsstol till ett trots allt rimligt pris. Vi har provat den på redaktionen under flera dagar utan att märka några problem, utom den där batterifickan då."
Google Hangouts,2020-06-17,8.4,Morten Skeldal Østergaard,Hangouts är Googles smidigt integrerade tjänst för videosamtal.,Program appar spel, Fint integrerad i Googles tjänster," Rörigt urval av videoappar
",Det går att videosamtal med flera personer samtidigt. Det fungerar mycket bra. Den person som pratar visas automatiskt med den största bilden. Det går även att se alla deltagare samtidigt.
Lenovo ThinkVision M14,2020-05-27,8.1,Markus Dahlberg,Portabel bildskärm,Skärm, Hög byggkvalitet," Få skärmmenyer
",För den som jobbar mobilt med en dator blir det ofta ont om utrymme på skärmen. Där är ThinkVision det perfekta tillbehöret som verkligen underlättar arbetet. Skärmen är tunn och enkel att ta med. Dessutom skickar Lenovo med ett fodral i filt. Strålande.
Apption Labs Meater Block,2020-05-19,9.7,Morten Skeldal Østergaard,Det utlimata grillverktyget.,Diverse, Bra app," Dyr
","Appen är lätt att förstå sig på, även om den är på engelska. En graf visar hur temperaturen har ändrats under grillningen och det är till exempel intressant att se hur mycket temperaturen sjunker så fort locket på grillen öppnas."
TP-Link AX11000 Tri-Band Gaming Router,2020-05-19,9.6,Henrik Ræder Clausen,Hypersnabb Wi-Fi 6-router med många funktioner.,Router, Höga prestanda," Svårläst användargränssnitt
","Ett stort plus är alla portar. Det går att ansluta hela åtta enheter via kabel och routern kan komma upp i hastigheter på upp till 2,5 gigabit i sekunden. Tack vare något som kallas för Link Aggregation kan en nätverkshårddisk anslutas till två nätverksportar samtidigt för att det ska gå riktigt snabbt att läsa och skriva till den."
Asus ROG Strix Scope PBT,2020-05-05,9.1,Morten Skeldal Østergaard,Ovanligt gediget tangentbord.,Tangentbord, Riktigt bra tangenter,,"ROG Strix Scope ansluts till datorn via en tjock, tygklädd usb-kabel. Det finns räfflor på undersidan för att leda kabeln åt det håll man vill – mycket praktiskt."
Samsung Galaxy A51,2020-03-17,6.9,Morten Skeldal Østergaard,Halvtrist mobil i mellanklassen.,Telefon, Bra skärm, Lite seg,"I skärmens nedre del gömmer det sig en fingeravtrycksläsare. Den är lite trög den också och några gånger lyckas vi inte logga in i telefonen med hjälp av den, utan tvingas knappa in pinkoden i stället. Ingen katastrof, men trist."
Netgear Orbi RBK13,2020-05-04,8.4,Henrik Ræder Clausen,Stabilt meshsystem.,Router, Bra täckning, Låga hastigheter i utkanten,"Våra hastighetsmätningar visar fina topphastigheter på 626 megabit i sekunden, men bara när trafiken går direkt via huvudroutern. Precis som med andra meshsystem faller hastigheterna snabbt när trafiken går via en av satelliterna. I det här fallet mäter vi då upp runt 40 megabit per sekund. Därför bör enheter som kräver mycket bandbredd, som till exempel en smart-tv, vara placerade så att de strömmar via huvudenheten."
Fitbit Aria Air,2020-06-30,8.9,Morten Skeldal Østergaard,Billig smartvåg.,Diverse, Smart våg," Mäter ej fettprocent
","Appen är densamma som används till Fitbits stora utbud av hälsoarmband. Den som har ett sådant får alltså alla data samlade på ett ställe. Då går det inte bara att hålla koll på viktutvecklingen, utan även puls, antal dagliga steg och sömnmönster."
Lenovo ThinkVision P44w-10,2020-05-08,8.5,Markus Dahlberg,Enorm bildskärm som ersätter två 27-tummare.,Skärm, Hög bildkvalitet," Dyr
","Det enda som inte är på topp är knapparna för att styra inställningsmenyerna. De sitter på framsidans nedre högra kant och är där visserligen lätta att nå, men markeringarna för de sex knapparna är otydliga, med resultat att man hela tiden trycker fel. Menyerna finns bara på engelska och för att förstå dem fullt ut måste man leta upp den engelska manualen på internet. Här finns det plats för förbättring."
Lenovo Yoga S940,2020-03-20,9.0,Morten Skeldal Østergaard,Vältrimmat kraftpaket.,Dator, Liten och lätt, Reflexer i skärmen,Datorn laddas via usb c och laddningen kan ske via vilken som helst av de tre usb c-portarna. Det är rätt tänkt och mycket praktiskt eftersom det alltid går att välja den port som är vänd åt det håll där vägguttaget finns.
SteelSeries Apex Pro TKL,2020-02-17,9.3,Morten Skeldal Østergaard,Fintrimningsbart tangentbord.,Tangentbord, Varierbar slaglängd,,"På tangentbordets undersida finns det en rad räfflor där sladden kan tryckas fast, så att användaren kan bestämma var sladden ska komma ut. Smart! En annan bra detalj är handlovsstödet som fästs med magneter."
HyperX Cloud Stinger Wireless,2020-01-23,8.6,Morten Skeldal Østergaard,Trådlöst headset till datorn.,Hörlurar och headset, Godkänd ljudkvalitet," Micro-usb
",Batteritiden anges av HyperX till 17 timmar. Det överensstämmer ungefär med vad vi kommer fram till. Vi kan använda lurarna under tre arbetsdagar innan det behöver laddas igen.
HP Envy x360 Convertible 13-ar0802no,2020-02-06,8.0,Morten Skeldal Østergaard,En blandning mellan dator och surfplatta.,Dator, Liten och lätt, Ingen usb c-laddning,"Till höger om den breda musplattan sitter det en fingeravtrycksläsare, som snabbt loggar in i Windows. Den är formad som en kvadrat och det räcker att lägga fingret på den för att tekniken ska känna av fingeravtrycket."
Trust Torro GXT 698,2020-01-23,7.9,Morten Skeldal Østergaard,Bastung surroundanläggning till datorn.,Högtalare, Utmärkt surroundljud, Dominant bas,
Netgear Orbi AX6000,2020-02-21,9.4,Henrik Ræder Clausen,Meshsystem med WiFi 6.,Router, Höga topphastigheter," Hemskt dyr
","Efter installationen skapar de ­båda enheterna ett enda nätverk, vilket är grejen med meshtekniken. Därefter är det bara att ansluta enheter till nätverket utan att behöva bry sig om ifall man ska välja 2,4- eller 5-gigahertzbandet. Smidigt."
Belkin Wireless Charging Vent Mount 10 W,2020-01-17,7.9,Morten Skeldal Østergaard,Trådlös mobilladdare för instrumentbrädan.,Portabelt batteri, Välbyggd," Långsam laddning
","Laddningen sker med tio watt, men det går inte särskilt snabbt. Effekten är dock fullt tillräcklig för att hålla i gång telefonen under färden. Det fina är att det hela är så bekvämt och smidigt."
Samsung Galaxy Tab S5e,2020-01-17,8.3,Morten Skeldal Østergaard,Tunn och lätt surfplatta.,Pekdator, Bra prestanda, Bixby fattar inte svenska,"Skärmen är, som alltid från Samsung, en av höjdpunkterna. Den är stor, ljusstark och har en fantastisk kontrast där vit text på svart bakgrund nästan skär i ögonen."
Kaspersky Internet Security (2020),2020-01-18,9.6,Morten Skeldal Østergaard,Omfattande säkerhetspaket för datorn.,Program appar spel, Effektivt skydd,,
TP-Link Deco P9,2020-01-20,8.4,Henrik Ræder Clausen,Meshsystem med tre routrar via Wi-Fi och elledningarna.,Router, Höga topphastigheter," Begränsade administrationsmöjligheter
","Appen fungerar som administrationscentral för hela systemet. Det ser inte ut som om det går att styra särskilt mycket, men under menyn avancerat finns det en hel rad fina funktioner, till exempel trafikprioritering, vidarebefordring av portar och mycket annat som mer avancerade nätverksanvändare tycker är kul. Jämfört med traditionella routrar i samma prisklass är dock möjligheterna begränsade."
AVG Internet Security,2020-01-20,9.4,Niklas Ernst,Skydd för tio olika typer av enheter.,Program appar spel, Hög säkerhet," Lite krångliga inställningar
","Förutom virusskyddet stoppar AVG Internet Security attacker från hackare, och det går att utföra betalningar online extra säkert – både via internetbanken och i olika webbutiker. Det går även att begränsa åtkomsten till datorns webbkamera och välja att till exempel program måste få tillstånd av dig för att komma åt kameran. Eller så stänger man bara av kameran helt och hållet."
Adata SC685 Ultra Slim 500 GB,2020-01-19,9.4,Morten Skeldal Østergaard,Liten extern ssd.,Hårddisk, Extremt snabb," Högt pris/gigabyte
","Adatas ssd har ungefär samma mått som ett kreditkort, om än en hel del tjockare. Den väger så lite att den knappt märks när man stoppar ner den i en ficka eller väska."
Huawei Nova 5T,2020-01-20,9.0,Morten Skeldal Østergaard,Mellanklasstelefon med toppegenskaper.,Telefon, Bra kamera," Inget hörlursuttag
",Batteritiden är inget annat än toppen. Batteriet räcker lätt en vanlig dag med lite fotografering och Google Mapsande. Vid dagens slut finns det ändå ström kvar för ett halvt dygn till.
Logitech G815,2020-01-19,8.4,Morten Skeldal Østergaard,Mekaniskt tangentbordet med udda finess.,Tangentbord, Bra tangenter," Liten entertangent
","Då är de fem snabbknapparna till vänster bättre. De kan programmeras och de är enkla att nå med vänsterhandens lillfinger. De sitter där de sitter eftersom detta är ett speltangentbord, och i ett sådant är tangenterna W, A, S och D viktigast. Just i det läger når lillfingret snabbtangenterna perfekt."
HP EliteDisplay E273,2020-01-19,7.9,Morten Skeldal Østergaard,En basskärm som trivs lika ensam som i dubbel uppsättning.,Skärm, Fin kvalitet för priset," Halvdan kontrast
",Vad gäller ergonomibetyget kammar HP hem full pott denna gång. Det går att justera skärmen 15 centimeter i höjdled tack vare det kraftiga aluminiumstativet. Skärmen kan vinklas in för att passa perfekt och den runda foten på stativet gör det lätt att vrida på skärmen. Den kan även vridas på högkant och med ett par E273 bredvid varandra i det läget får man en imponerande skärm.
Huawei Watch GT2 46 mm,2020-01-17,8.4,Morten Skeldal Østergaard,"Smartklocka som visar tid, mäter antal steg, tar pulsen och mycket annat.",Smartklockor, Många funktioner," Trögstartad skärm
","Klockan drivs av operativsystemet Google Wear OS, som kommunicerar med appen Huawei Health för Android eller iOS. Det är lätt att komma överens med menysystemet i GT2. Från urtavlan går det att dra vertikalt eller horisontellt för att komma åt funktioner som till exempel stegräknare, larm och meddelanden. På klockans baksida finns det en pulsmätare som kontinuerligt mäter pulsen."
Acer Swift 3 – SF314-57-710U,2020-01-19,8.4,Morten Skeldal Østergaard,Lätt bärbar för kontorsarbete.,Dator, Liten och lätt, Få portar,"Till höger nedanför tangentbordet sitter det en liten fingeravtrycksläsare. Den är minimal, men läser av fingret snabbt och loggar kvickt in i Windows. "
F-Secure Safe (Android),2020-01-19,8.5,Morten Skeldal Østergaard,Komplett säkerhetspaket till mobilen.,Program appar spel, Skyddar tre enheter," Falsk säkerhetsvarning
",Till SAFE följer det med ytterligare en app – en säker webbläsare som skyddar telefonen och dig mot webbsidor med potentiellt farligt innehåll.
Ikea Trådfri – set med gatweay,2019-12-13,6.9,Morten Skeldal Østergaard,Smarta glödlampor som kan styras vi en app i mobilen.,Diverse, Billigt, Kräver gateway (hubb),"Till en början fungerar systemet perfekt och vi kan styra de båda lamporna som ingår i startpaketet från både appen och fjärrkontrollen. Efter ett tag gick det dock inte att styra en av lamporna längre. Det visade sig bero på att någon hade stängt av lampan med dess vanliga strömbrytare. Det är bra att lamporna fungerar precis på samma sätt som vanliga lampor, men för att fjärrstyrningen ska fungera måste man tänka på att låta strömbrytarna vara på."
Alienware AW5520QF,2019-12-13,7.9,Markus Dahlberg,En OLED-skärm på 55 tum med 4K-upplösning och rekordhög kontrast.,Skärm, Enorm, Enorm,"Till och med högtalarna imponerar. De båda 14-wattarna hör till de bättre monitorhögtalare vi har testat, även om en modern ljudlimpa som tillbehör gör filmer mer rättvisa."
Lenovo Tab P10,2020-01-17,8.2,Morten Skeldal Østergaard,Välbyggd surfplatta för hela familjen.,Pekdator, Rimligt pris," Barn-appen är inte på svenska
",Skärmen är i 16:10-format vilket innebär att filmer och tv-serier visas med ett svart streck över och under bilden. Det är lite underligt när Lenovo till och med har förinstallerat Netflix-appen som strömmar film i det betydligt vanligare 16:9-formatet. 
"Lenovo Yoga Smart Tab 10,1″ 32 GB",2020-01-19,9.1,Henrik Ræder Clausen,Androidbaserad surfplatta med simkort och annorlunda stativ.,Pekdator, Genialt stativ," Medelmåttiga prestanda
","Hastighetsmätningarna visar att Yoga Smart Tab är dubbelt så snabb som sin föregångare. Det är en välkommen förbättring, men det gör inte Lenovos surfplatta till den snabbaste precis. Är det prestanda som gäller finns det bättre alternativ – men knappast några lika smarta."
Sony Xperia 5,2020-01-18,8.8,Morten Skeldal Østergaard,Lång mobiltelefon med delbar skärm.,Telefon, Bra skärm, Dåliga foton i svagt ljus,Sony tar som så ofta sina egna vägar även i andra sammanhang. Fingeravtrycksläsaren sitter till ­exempel inte i skärmen utan på ena långsidan. Det är bara att peka på den med fingret så låses telefonen upp. Det är inte alls dumt. Tekniken är snabb och det känns naturligt att lägga fingret där.
Dynabook Portégé X30-F,2020-01-19,8.6,Markus Dahlberg,Lättviktsdator för hemmakontoret.,Dator, Lätt och smidig, Svajig skärm,"X30-F är ingen racer, men den känns snabb i vardagen och allt som hör kontorsarbete till flyter på utan problem. Den känns till och med kvick mellan varven, och det går snabbt att sätta i gång att jobba."
Redragon Cobra,2020-01-20,7.8,Morten Skeldal Østergaard,Lågprismus för datorspelare.,Mus, Billig," För glatt yta
","Cobra är en ganska smal mus som passar en lite mindre hand. Den ligger skönt i handen och det enda vi saknar i ergonomisk väg är ett bättre grepp på sidorna, kanske med gummi i stället för som nu med plast. "
Huawei FreeBuds 3,2019-11-19,7.6,Markus Dahlberg,Trådlösa hörlurar med stil.,Hörlurar och headset, Bra passform, Trist styrning,"Ljudkvaliteten i övrigt är okej, men inte mer. För de två tusen som Huawei vill ha kan vi definitivt begära bättre ljudkvalitet. Det låter lite instängt i de yttre frekvenserna och ibland hörs ljud i musiken som vi aldrig har upplevt tidigare? Digitala artefakter på grund av brusreduceringen? Svårt att veta, men det känns lite svajigt."
Bullguard Internet Security,2020-01-21,8.0,Niklas Ernst,"Hög säkerhet, men det ser rörigt och trist ut.",Program appar spel, Inbyggd backup," Inte så intuitivt
",BullGuard kan blockera både hemsidor och program. Det är smart om minderåriga använder datorn och du inte vill att de ska komma åt vissa webbsidor eller inte kunna starta vissa program. Denna funktion är enkel att ställa in och den blockerar de valda objekten effektivt. 
Bitdefender Internet Security,2020-01-20,9.4,Niklas Ernst,Säkerhetsprogram med fokus på integritet.,Program appar spel, Hög säkerhet,,"I en kolumn till vänster finns det fler funktioner. Under Skydd finns alla verktyg som används för att skydda datorn, det vill säga antivirus, brandvägg, antispam och så vidare. Här går det även att söka igenom datorn efter andra säkerhetsrisker, till exempel dåliga lösenord, saknade Windowsuppdateringar eller säkerhetsstatusen för nätverket."
Airthings Wave Mini,2020-01-20,8.5,Morten Skeldal Østergaard,Liten klimatmätare för inomhusbruk.,Diverse, Bra app," Bara avläsbar hemma
",För att se hur det står till med klimatet därhemma är det bara att vifta till framför pucken med handen. En röd prick innebär att halten av skadliga partiklar har nått kritiska nivåer. Lyser det gult ska man se upp och är pricken grön är allt okej. 
Arlo Pro 3,2020-01-23,9.1,Morten Skeldal Østergaard,Helt trådlös övervakningskamera.,Övervakningskamera, Bra app," Dyr
","Inspelningarna i upplösningen 2560×1440 pixel blir mycket bra. Kameran har ett synfält på 160 grader, så den täcker ett ganska stort område. Inspelningarna sparas alltid online på det konto som ingår, så även om någon stjäl kameran finns filmerna kvar."
F-Secure SAFE,2020-01-21,8.3,Niklas Ernst,Elegant säkerhet med vettiga funktioner.,Program appar spel, Hög säkerhet," Få funktioner
",Startfönstret visar tydligt om datorn är säker eller hotad. Här ser man direkt om datorn är skyddad och programmet uppdaterat. Det finns även ett surfskydd som bland annat ger ett extra skyddslager när internetbanken används. I praktiken innebär det att vissa webbsidor och tjänster är blockerade när internetbanken är öppen. Det är smart eftersom det då blir svårare för utomstående att komma och betalningsinformation.
Norton 360 Standard,2020-01-21,9.5,Morten Skeldal Østergaard,En av de bästa säkerhetsprogrammen blir tvåa.,Program appar spel, Ett av de effektivaste säkerhetsprogrammen," En falsk varning
","AV-Test undersöker också om Norton 360 kan se skillnad på virus och säkra program som uppträder misstänkt. Det visar sig att Norton 360 ger en falsk varning för ett säkert program. Det är ingen katastrof, men det finns konkurrenter som klarar detta bättre. Detta misstag petar ner Norton till andraplatsen i vårt jämförande test."
ErgonomicScrollApplication,2020-02-03,8.3,Morten Skeldal Østergaard,Enkel app som automatiserar mushjulet.,Program appar spel, Mindre jobb för pekfingret, Dyrt för en enda funktion,Det hela kräver viss tillvänjning eftersom rullriktningen inte ändras även om man rullar åt andra hållet. Pekaren måste föras lite åt sidan för att rullningen ska stoppas. Efter ett tag känns det dock naturligt.
Avast Mobile Security,2020-02-03,7.4,Morten Skeldal Østergaard,Billig säkerhetslösning för Android.,Program appar spel, Stoppade alla virus," En falsk varning
",Det är extremt enkelt att använda Avast Mobile Security. Huvudfunktionen att stoppa och leta efter virus tar upp ungefär en tredjedel av appen. Det är bara att trycka på den orangefärgade knappen för att kontrollera telefonen. Det finns ytterligare några funktioner som kan förbättra telefonens prestanda – det går till exempel att rensa ramminnet och ta bort överflödiga filer som tar upp plats i onödan.
Icecream Slideshow Maker Pro,2020-02-06,8.6,Henning Dadkhah Rasmussen,Fascinerande bildspel,Program appar spel, På svenska,,"Den som vill förädla bildspelet ytterligare kan med fördel lägga på musik eller andra ljud till bilderna, kanske en kommentar. Slutligen går det att välja kvalitet och upplösning innan filen sparas eller bränns på en dvd eller cd."
Huawei WiFi Q2 Pro,2020-03-12,7.8,Henrik Ræder Clausen,Stabilt nätverk i hela huset.,Router, Stabilt nätverk, Halvdan räckvidd,"Räckvidden begränsas dessvärre av hemmets fyra väggar. Signalen har svårt att tränga igenom ytterväggarna och nå trädgården, något andra routrar klarar bättre. Nätverket ger upp på ganska korta avstånd och traditionella routrar med en enda enhet ger längre räckvidd än detta paket."
Huawei P Smart Pro,2020-02-06,7.6,Morten Skeldal Østergaard,Stor och tung mobil med lång batteritid.,Telefon, Lång batteritid," Ovanligt tung
","De tre kameralinserna på baksidan ger i stort sett samma möjligheter som i betydligt dyrare telefoner. Huvudkameran tar bra bilder och den kompletteras av en praktisk vidvinkellins och en lins med så kallad bokehfunktion, det vill säga en funktion för professionella porträtt där personen är skarp medan bakgrunden är suddig."
Twinkly Festoon,2020-02-03,6.7,Morten Skeldal Østergaard,Festlig ljusslinga som styrs med en app.,Diverse, Smart app, För få lampor,Vi hade dessvärre problem med ett par av lamporna. De kunde inte hålla samma färg som övriga lampor trots att vi ställde in det så i appen.
Fairphone 3,2020-01-11,7.5,Markus Dahlberg,Hållbar telefon att laga själv.,Telefon, Utbytbara delar, Android 9,Detta är ingen telefon för hetsiga konsumenter som måste ha det senaste. Fairphone 3 är en eftertänksam produkt för alla som förstår miljötänket och som nöjer sig med en bra telefon utan att ha behov av något annat än just det. Det är mycket sympatiskt. 
SteelSeries Rival 3,2020-02-06,8.2,Morten Skeldal Østergard,Bra mus med fint pris/kvalitet-förhållande.,Mus, Ovanligt lätt," Slingrig kabel
","Rival 3 är en trivsam kompis på skrivbordet under en arbetsdag. Den saknar alla former av ergonomiska detaljer, men den glider lätt och obesvärat över underlaget. Det enda som skvallrar om att detta är en spelmus är att logotypen och undersidan kan lysa i olika färger. Ljuset kan dock stängas av."
Rapoo MT550,2020-02-07,8.2,Morten Skeldal Østergaard,Smidig mus till en bärbar dator.,Mus, God ergonomi," Avigt placerat rullhjul
",Usb-adaptern är så liten att den kan sitta på plats i usb-porten när datorn packas ner. Det finns även plats för att förvara den under batterilocket på musens undersida. Det behövs två AA-batterier vilka Rapoo lovar räcker för att hålla i gång musen under ett år.
Sandberg 3in1 Card Reader,2020-02-09,8.4,Morten Skeldal Østergaard,Liten kortläsare med tredubbla usb-kontakter.,Diverse, Tre usb-typer," Locket lossnar
","Överföringshastigheterna är inte mycket att skryta med, men finessen med Sandbergs kortläsare är inte hastigheten utan dess mångsidighet."
MSI Prestige 15 A10SC,2020-03-09,8.9,Morten Skekdal,Välbyggd arbetsdator,Dator, Snabb,,"På sidorna finns ett bra urval av portar, bland annat två usb c-portar med stöd för Thunderbolt 3 – något som innebär riktigt höga överföringshastigheter."
HP Envy x360 Convertible 15-dr1038no,2020-02-21,8.3,Markus Dahlberg,15-tummaren med träinläggningar.,Dator, Träpanel," Lite småfet
","Det går till och med att arbeta med tunga bilder eller spela nyare spel utan att datorn kroknar. Lite synd är det att fläktarna drar i gång alltför fort, och de låter mycket."
Sandberg Powerbank 10000 Wireless 10W,2020-02-26,7.7,Morten Skeldal Østergaard,Trådlös laddare med sugkoppar.,Portabelt batteri, Sitter fast på telefonen," Tung
","Själva batteriet, eller powerbanken som det heter på nutidssvenska, laddas upp via en micro usb- eller en usb c-port. Det följer med en usb c-kabel på en halvmeter. Batteriet har en kapacitet på 10 000 milliamperetimmar, vilket räcker för att ladda en normalstor mobiltelefon 2,5 – 3 gånger."
Redragon Harpe,2020-02-26,6.2,Morten Skeldal Østergaard,Funktionsrikt lågpristangentbord.,Tangentbord, Många funktioner," Usel manual
","Med tanke på prislappen får vi riktigt många funktioner. De är emellertid ganska undangömda och svåra att hitta. Den enda manual som följer med är en tunn historia på engelska, och den ger inte mycket vägledning. Efter lite experimenterande inser vi att det går att spara makron i tangentbordet, det vill säga att de går att spara exempelvis en hel hemadress under någon av de fem G-tangenterna."
Dynabook Satellite Pro L50-G-17R,2020-02-22,7.2,Markus Dahlberg,Snabb arbetsdator.,Dator, Snabb, Slarvigt tangentbord,Innanmätet då? Här finns inte mycket att klaga på. Även om vi får den senaste generationen Core i7-processor och gott om ramminne är det den hypersnabba ssd:n som står ut. Datorn är snabb och startar Word lika kvickt som vi hinner klicka på ikonen. Batteritiden på knappa tio timmar imponerar i en så här pass stor dator och som arbetshäst gör den verkligen sitt jobb.
Asus ROG Theta 7.1,2020-02-27,9.4,Morten Skeldal Østergaard,Tungt headset med runt om-ljud.,Hörlurar och headset, Fin ljudkvalitet," Stora och tunga
","Anledningen till att ROG Theta ser nästan förstorade ut är att det kan ge äkta surroundljud. Det finns alltså flera högtalarelement inbyggda i kåporna för att ge ett ljud som verkligen kommer från alla håll. Det hela fungerar otroligt bra och effekten är förnämlig. Vi har provat headsetet tillsammans med några spel och gjort regelrätta surroundtester, och det hörs verkligen exakt varifrån i rummet ett ljud kommer. Det känns verkligen som att sitta mitt i ett vältrimmat surroundsystem med sju högtalare runt omkring. Imponerande."
JBL Live 650BT,2020-02-23,8.0,Markus Dahlberg,Schyssta vardagshörlurar med maffigt ljud.,Hörlurar och headset, Bra vardagslurar," Halvdan mikrofon
","Mindre bra är de anonyma knapparna på höger kåpa. Det är svårt att träffa rätt på första försöket, en vanesak givetvis men det går att göra fysiska knappar tydligare än så här. Ett annat minus är laddningen via micro-usb. Det fungerar ju, men det är ett kliv bakåt i tiden."
