Title,Date,Rating,Author,Summary,OCN,Pros,Cons,Verdict
Microsoft Surface Laptop 2,2019-09-29,7.8,Markus Dahlberg,En tunn och lätt bärbar pc som nu har kommit i en uppdaterad version.,Dator, Hög byggkvalitet, Känns gammaldags,"I övrigt finns det mycket att tycka om här. Musplattan är den kanske bästa vi har testat. Ansiktsinloggningen i Windows sker så blixtsnabbt att det inte gör någonting att det saknas en fingeravtrycksläsare. Den höga byggkvaliteten känns direkt när man tar tag i datorn och framför allt när man öppnar den. Locket kan öppnas med en hand (en underskattad finess) och datorn vaknar omedelbart. Tangenterna ger perfekt motstånd och de har en matt yta som är underbar att känna när man skriver. Området runt tangenterna och musplattan är klätt i Alcantara, som är ett syntetiskt fibermaterial som är aningen strävt. Det gör att händerna ligger stadigt utan att glida när man skriver."
Microsoft Arc Mouse,2019-09-20,8.6,Markus Dahlberg,En mobil Bluetooth-mus som kan fällas ut och bli helt platt. Innehåller många smarta lösningar.,Mus, Bra passform,,"Hur konstruktionen ser ut under det gummiliknande plastskalet vet vi inte, men om man ska döma av originalet bör den hålla under lång tid. Till det här testet plockade vi fram musen från 2009 och med nya batterier fungerar den alldeles utmärkt. Det enda som tycks ha hänt under åren är att plastmaterialet i den har avgivit något ämne som gjort den klibbig. Efter att ha skrapat bort klibbet och tvättat den känns den normal igen."
Apple Airpods (2019),2019-08-03,9.4,Markus Dahlberg,"Apples trådlösa öronproppar sätter standarden för hela industrin. Många är kallade, men ingen slår Apples design och funktionalitet.",Hörlurar och headset, Hög byggkvalitet,,De båda Airpodsen är också oöverträffat små och smidiga. De passar vilka öron som helst och det är extremt lätta att få på plats. Väl i örat glömmer man snart bort dem och oroligt nog sitter de kvar vad man än gör. Utformningen av öronsnäckorna är unik och i princip densamma som för Apples trådade hörlurar.
OnePlus 7,2019-08-23,7.8,Morten Skeldal Østergaard,OnePlus 7 är en mellanklassmobil med vissa frågetecken.,Telefon, Rätt pris," Överkänslig skärm
",Fingeravtrycksläsaren sitter gömd i skärmen. Ett ritat fingeravtryck visar var man ska trycka och det lyser upp väldigt starkt när sensorn har känt av fingret. Även om den här tekniken inte är lika snabb som en enskild fingeravtrycksläsare går det inte långsamt nog för att vara störande.
Pixum,2019-11-07,9.2,Morten Skeldal Østergaard,Jämförande test av fotokalendrar,Diverse, Gott om möjligheter, Stort program,"På skärmens vänstra sida visas bilderna som går att dra och släppa på den aktuella kalendersidan. På samma sida som bilderna kan du även välja bakgrunder och mallar som gör att du kan ha flera bilder på samma sida. På skärmens högra sida kan du klicka på de tolv månaderna och framsidan för att navigera mellan dem. Om du tycker att några bilder hör hemma i en speciell månad, kan du flytta mellan sidorna så att både bilder och layout följer med."
Logitech G MX518,2019-05-24,7.4,Markus Dahlberg,"Logitech uppdaterar en gammal klassiker, men bara under skalet. Allt annat är exakt som i originalet från 2005.",Mus, Perfekt passform," Originalet duger fortfarande
","Under skalet sitter Logitechs nya sensor Hero 16k som förstås är mycket känsligare än originalet. Skillnaden märks, men inte så mycket som man kan tro."
Samsung Galaxy S10+,2019-08-12,9.6,Henrik Ræder Clausen,Android-telefon i toppklass med en stor skärm och fem kameror.,Telefon, Fantastisk skärm,,"På baksidan sitter det tre olika kameror varav två har vidvinkel- respektive teleobjektiv, som kameraappen automatiskt skiftar mellan. Kamerorna på 12 och 16 megapixel ger fina bilder med naturliga färger och hög upplösning i detaljerna. Färgerna kan tyckas vara aningen bleka, men det beror faktiskt på att de är mer naturtrogna än i andra kameror. Undantaget vid dåligt ljus kan Galaxy S10+ ersätta en riktig kamera."
Philips 276E9QJAB,2019-05-10,8.5,Henrik Ræder Clausen,27-tummare med inbyggda högtalare.,Skärm, Fina färger, Dåliga högtalare,"Till en början är inte färgerna något att yvas över. De är okej med en dragning åt det kalla hållet. Här utnyttjar 276E9QJAB ett litet trick som är dolt bakom logotypen: en sensor anpassar färgbalansen efter det aktuella spelet eller programmet som visas på skärmen. Det må låta underligt, men det fungerar faktiskt riktigt bra och färgerna känns rätt i alla situationer."
Dell XPS 13 9380 (2019),2019-05-09,9.0,Markus Dahlberg,Årets version av Dells framgångsrika 13-tummare som fortfarande håller sin positionen som marknadens ledande ultrabook.,Dator, Snabb och nätt," Dyr
",Det finns mycket att tycka om i XPS 13. Den i strömbrytaren inbyggda fingeravtrycksläsaren är ett exempel. Ett annat det behändiga formatet och det faktum att detta är en ruskigt snabb dator som är enkel att ta med överallt och i alla sammanhang. Vi gillar även programmet Power Manager där det går att ställa in hur värmen ska hanteras. Här finns val som Tyst och Ultraprestanda och som påverkar hur fläktarna jobbar – och därmed hur mycket datorn låter. Det är faktiskt inte alls så dumt.
Canon Pixma TS6250,2019-06-04,8.6,Morten Skeldal Østergaard,"En liten multifunktionsskrivare för att skriva ut, skanna in och kopiera.",Skrivare, Enkel att använda," Klumpig design
","De tre grundläggande funktionerna för att skriva ut, skanna in och kopiera tar upp det mesta av utrymmet på den tryckkänsliga skärmen. Menyerna är välgjorda och det är enkelt att hitta rätt funktioner för att till exempel välja mellan färg eller svartvitt. Ett stort plus i sammanhanget är att menyerna är på svenska."
Acer Chromebook Spin 13,2019-06-04,8.8,Henrik Ræder Clausen,En kombinerad bärbar dator och surfplatta med ChromeOS.,Dator, Smart dubbeldesign," Få anslutningar
","Alla Windowsprogram kan vi förstås glömma direkt. De fungerar inte alls här. Däremot har Google och Acer lyckats med konststycket att få Android-appar att fungera i Chrome OS. Därmed finns det ett rikt urval av ­allehanda appar. Det är visserligen aningen udda att se appar köras i fönster, men det fungerar överlag bra. "
Urbanista Stockholm,2019-05-09,8.2,Markus Dahlberg,Trådlösa hörlurar i form av öronsnäckor i trendiga färger och minimalistisk design.,Hörlurar och headset," Snygga, lätta och smidiga"," Halvdan ljudkvalitet
","Ett större problem dock är att lurarna börjar kännas obekväma efter tid i öronen. De trycker mot ytterörat och det blir i längden inte skönt. Återigen jämfört med AirPods är Stockholm lite större på alla ledder: De är 1,7 millimeter bredare, 0,4 millimeter högre och 0,8 millimeter tjockare. Det kan låta lite, men i mina öron märks skillnaden."
Dell S2719DC,2019-05-14,8.8,Markus Dahlberg,En ultratunn bildskärm med usb c-ingång och upplösningen 2560 x 1440 pixel.,Skärm, Otrolig bildkvalitet, Dyr,"Förutom alla redan beskrivna fördelar är dessutom bilden otroligt bra, kanske en av de bästa vi har testat. Skärmen är ljusstark och alla färger vibrerar av liv. S2719DC stödjer FreeSync som förbättrar grafiken i spel och även om svarstiderna är måttliga på papperet hänger skärmen med utan synbara problem."
Plantronics BackBeat GO 810,2019-05-16,6.9,Markus Dahlberg,Stramt formgivna hörlurar med aktiv brusreducering.,Hörlurar och headset, Brusreducering, Platt ljud,"Dumt nog använder GO 810 inte samma app som PRO 2, å andra sidan är den här appen mer användbar. Här finns alla inställningar tillgängliga tillsammans med manualen. Det är dock synd att det inte går att fintrimma ljudet mer. Det skulle behövas för att få fart på hörlurarna."
Huawei P30 Pro,2019-05-22,9.6,Morten Skeldal Østergaard,Huawei P30 Pro är en av de bästa mobiltelefonerna hittills. Kameran är helt i särklass.,Telefon, Snabb, Seg fingeravtrycksläsare,"En fördel med stora telefoner är att det får plats stora batterier i dem, och Huawei P30 Pro är inget undantag. Med en kapacitet på 4 200 milliamperetimmar finns det ström nog för en hel dags aktiv användning av telefonen. Även vid flitigt bruk av kameran, mycket surfande och gps-positionering har batteriet aldrig varit i närheten av att vara tomt i slutet av dagen. Dessutom går det ovanligt snabbt att ladda det med den medföljande laddaren. En detalj i sammanhanget är att P30 Pro stödjer trådlös laddning och att den själv kan agera som laddplatta för andra enheter."
BenQ BL2420PT,2019-06-26,9.2,Henrik Ræder Clausen,Bildskärm med hög upplösning och pivotfunktion.,Skärm, Mycket hög färgkvalitet,,"BenQ utlovar att BL2420PT klarar två professionella färgstandarder och att den är finkalibrerad på fabriken. Det håller – nästan. Färgerna är mycket riktigt utmärkta, men de är aningen för mättade. Detta går förstås att justera manuellt."
Huawei Matebook 13,2019-04-24,9.3,Markus Dahlberg,En modern bärbar pc med en kraftfull processor och stor ssd. Bra integrering med Huaweis mobiltelefoner.,Dator, Välbyggd och smidig," Blank skärm
","En smidig funktion är Huawei Share som används för enkel filöverföring mellan exempelvis en av Huaweis nyare mobiltelefoner och datorn. Tekniken använder NFC och det räcker att med mobilen nudda ytan till höger om musplattan för att en bild ska överföras till datorn. Dumt nog hamnar bilderna inte i mappen Bilder, vilket vore naturligt, utan i mappen HwShare i mappen Dokument. Därmed dyker de inte heller upp i Windowsappen Foton. För att se bilderna där måste appen ställas in att innehållet i mappen HwShare ska visas. Aldrig får man vara riktigt glad."
Jabra Move Style Edition,2019-05-30,7.1,Markus Dahlberg,Nygamla utanpå-örat-hörlurar med nya färger och längre batteritid.,Hörlurar och headset, Lätta och tåliga, Ingen app,På vänster kåpa finns det en tredelad knapp för att justera ljudvolym och för att hantera samtal. Knappen är ganska smal och det är svårt att snabbt hitta rätt till volymreglagen. På höger kåpa sitter strömbrytaren som även dubblerar som parningsknapp. Här finns även micro-usb-porten för laddning.
HyperX QuadCast,2019-06-03,9.5,Henrik Ræder Clausen,Bordsmikrofon med dämpande upphängning och variabel inspelningsriktning.,Hörlurar och headset, Fokus på rösten,,"Det första intrycket av ljudkvaliteten imponerar. Röster spelas in klart och tydligt och den varierbara inspelningsriktningen fungerar överraskande bra. Spelas bara en röst in dämpas omgivande ljud. Spelas ett samtal mellan två personer in blir båda rösterna mycket tydliga, medan störande ljud från omgivningen tonas ned."
Samsung Galaxy A20e,2019-06-09,6.5,Henrik Ræder Clausen,Androidbaserad mobiltelefon med dubbla simkort och tre kameror.,Telefon, Dubbla simkort, För klen för tunga appar,"Våra prestandamätningar visar att Galaxy A20e hamnar i den långsammaste femtedelen av alla mobiltelefoner. Den är stark nog för att hantera YouTube, men större appar känns sega. Den lägre prestandan märks främst i 3d-spel som blir i det närmaste ospelbara eftersom telefonen inte hänger med."
Netgear Nighthawk Pro Gaming XR500,2019-06-08,8.6,Henrik Ræder Clausen,Trådlös spelrouter med WiFi 5 och två usb 3-portar.,Router, Lång räckvidd,,Hastighetsmässigt finns det inte heller något att klaga på. Vi mäter upp 652 megabit i sekunden till ethernetanslutna enheter och 260 dito i det trådlösa nätverket. Därtill kommer att routern har prestanda nog för att hålla höga hastigheter på alla frekvenser samtidigt. Räckvidden är dessutom bland de bästa i klassen och fullt tillräcklig för stora bostäder. Vi får bra och stabil täckning i utrymmen som andra routrar inte klarar.
Asus TUF Gaming FX505,2019-06-10,9.5,Henrik Ræder Clausen,Robust bärbar speldator med vasst grafikkort och full hd-skärm.,Dator, Välbyggd," För liten ssd
","Processorns topphastighet är moderata 2,2 gigahertz, men den har å andra sidan sex kärnor med så kallad Hyperthreading (flera processorer kan köras samtidigt). Det passar program och spel som kan utnyttja flera processorkärnor, men innebär en begränsning för de som inte kan det. En fördel är i alla fall att datorn håller ett jämt tempo även när många program körs samtidigt."
Google Nest Hub,2019-06-03,9.3,Morten Skeldal Østergaard,Med Google Nest Hub blir det lättare att styra det digitala hemmet.,Diverse, Rimligt pris,,En bra säkerhetsfiness för att slippa känna sig avlyssnad av Google Nest Hub hela tiden är den lilla avstängningsknappen på baksidan för mikrofonen.
Toshiba Portégé X30T-E,2019-06-10,7.2,Markus Dahlberg,En 2 i 1-dator med lång batteritid och ovanligheter som vga-port och ethernetport.,Dator, Välbyggd, Stor och bylsig,"Toshiba får dock plus i kanten för att datorn är så välbyggd och stadig. Det märks inte minst på gångjärnen som håller ihop skärmen med tangentbordet. Det är riktigt rejäla och ser ut att hålla hur länge som helst. Det är dessutom mycket enkelt att koppla isär och ihop de båda delarna. Här märks det att detta egentligen är en arbetshäst för professionellt bruk, och inte en slick hemdator. Det är rejält och lite gammaldags."
Adata PV120 Power Bank,2019-06-11,8.8,Henrik Ræder Clausen,Batteripaket i fickstorlek med dubbla usb-portar.,Portabelt batteri, Praktisk storlek,,"De två usb-uttagen är märkta med 2,4 respektive 1 ampere. I realiteten är dock inte skillnaden så stor eftersom vi bara fick ut runt 1,5 ampere ur det starkare uttaget. Strömmen räcker i alla fall till för effektiv laddning av två enheter samtidigt. "
Alienware Area-51m,2019-06-12,10.0,Markus Dahlberg,En fullsmetad bärbar stationär pc av sällan skådat slag.,Dator, Otrolig maskin," Hisnande dyr
","Att jobba med Area-51m är i alla lägen en befrielse. Word har startat i samma ögonblick som dubbelklicket på programikonen är avslutat. Vi har ännu inte hittat något spel som får Area-51m att tveka det minsta. Det går till och med snabbt att uppdatera Windows. Medan andra datorer kämpar i timtal för att uppdateras till version 1903 av Windows 10, är det överstökat på en kvart. Vi renderar 3d-grafik på ett par timmar medan vår två år gamla speldator med topprestanda då, behöver en natt på sig. Det är som att jämföra Koenigsegg med Daf. Eller Saab Gripen med bröderna Wright."
Asus ZenBook UX433FA,2019-06-26,8.6,Henrik Ræder Clausen,Ultraportabel dator med slimmat metallchassi.,Dator, Stor skärm i liten pc," Få anslutningar
","ZenBook är inte en av de snabbare datorerna vi har testet, även om den klarar allt i vardagen utan att krokna. Mätvärdena är klart godkända och det är framför allt den snabba ssd:n, med en läshastighet på 1,7 gigabyte i sekunden, som drar upp testvärdena. Det integrerade grafikkortet däremot drar ner prestandamätningarna. För en så här pass kompakt dator är  slutresultat trots allt utmärkt."
Bang och Olufsen Beoplay E8 2.0,2019-06-13,9.4,Henrik Ræder Clausen,Trådlösa öronproppar utan aktiv brusreducering.,Hörlurar och headset, Mycket bra ljud,,"Det första intrycket av ljudet är att det är så spatiöst. Här finns massor med plats för röster och instrument. Allt är mycket tydligt definierat och det är lätt att identifiera enskilda instrument i ljudbilden. Det är bett i trummor och slagverk, men det är främst i mellanregister och diskant som Beoplay E8 2.0 levererar. Det är ett sant nöje att lyssna på välgjorda inspelningar."
Canon Zoemini C,2019-06-17,4.3,Morten Skeldal Østergaard,"Canons minikamera skriver ut tagna bilder direkt, men bildkvaliteten är inget vidare.",Kameror, Direktutskrift av bilder, Låg kvalitet,"Bilderna kan sparas på ett micro-sd-kort (ingår inte) och det går även att skriva ut via den tillhörande appen i mobilen. Det går att knäppa bilder via appen och det finns en rad effekter, ramar, och annan grafik som tillsammans med text kan läggas på bilderna. "
Jabra Elite 85H,2019-06-13,9.4,Markus Dahlberg,"Ett par heltäckande hörlurar med fokus på hög ljudkvalitet för både samtal, musik och film, såväl på kontoret som hemma och på resan.",Hörlurar och headset, Välbyggda," Dyra
","Det märks att Jabra har gjort hörlurar ett tag, för det är i detaljerna som Elite 85h utmärker sig. Så fort de viks ihop stängs de av och de startar direkt de sätts på huvudet."
OnePlus 7 Pro,2019-06-26,7.6,Morten Skeldal Østergaard,OnePlus har gjort en ruskigt snabb mobiltelefon med en fantastisk skärm. Dessvärre hänger inte batteriet med.,Telefon, Extremt snabb," Drar mycket ström
","Ett udda problem är skjutreglaget för att ändra telefonen mellan ljudlös, vibration och ringsignal. Det sticker nämligen ut en aning på ena långsidan och vi har flera gånger upplevt att reglaget fastnar i fickkanten när telefonen stoppas ner i fickan, varpå inställningen ändras ofrivilligt."
Ultimate Ears Wonderboom 2,2019-07-03,8.6,Magnus Cold,Ultimate Ears är en vattentät högtalare för poolen och stranden.,Högtalare, Kan spela högt, Droppar när den har torkat,"Det är lätt att ta med sig Wonderboom eftersom den är så kompakt och för att den dessutom är IP67-klassad. Den är alltså dammtät och den kan ligga och skvalpa i poolen en halvtimme utan att ta skada. När högtalaren tas upp ur vattnet torkar den snabbt, men det kan ändå droppa om den ett bra tag eftersom det samlas en del vatten innanför tyget."
Sandberg USB-C AC Charger PD 90W,2019-07-06,9.1,Henrik Ræder Clausen,Universalladdare med automatiskt spänningsval för usb c-enheter.,Diverse, Hög kapacitet," Tar mycket plats i vägguttaget
","Det hela fungerar perfekt. Med en effekt på 90 watt går det att ladda en dator på en timme och mobiltelefoner med snabbladdningsteknik går förstås ännu snabbare. Faktum är att laddaren nästan är onödigt kraftfull eftersom många datorer inte kan dra nytta av laddarens 90 watt. Då kan man nöja sig med Sandbergs 65-wattsladdare i stället, som är 130 kronor billigare."
Trust GXT 161 Disan Wireless Gaming Mouse,2019-07-06,7.4,Henrik Ræder Clausen,Trådlös mus med hastighetsknapp och programmerbara knappar.,Mus, Hög precision," Instabilt batteri
","Inställningsprogrammet är ett nöje att använda. Det ger god kontroll över alla inställningar, inte minst känsligheten (i praktiken hur snabbt pekaren rör sig), och alla knappar kan programmeras om med andra funktioner. Det går även att lägga till makron till en knapp, vilket rätt använt kan spara mycket tid."
MSI GL63 8SE,2019-07-06,9.0,Morten Skeldal Østergaard,MSI GL63 är en speldator med i för genren klassiskt svart och rött.,Dator, Snabb," Ljussvag skärm
","Tacknämligt nog har skärmen en matt yta som trollar bort i stor sett alla reflexer. Tyvärr är skärmen ganska ljussvag, så det kan vara svårt att se bilden om man arbetar i alltför starkt dagsljus."
Skullcandy Indy,2019-06-28,7.8,Markus Dahlberg,Trådlösa öronproppar med 16 timmars batteritid och laddare och fodral i ett.,Hörlurar och headset, Rimligt pris, Enkel ljudbild,Å andra sidan är det mindre roligt att Skullcandy håller fast vid gamla Micro-usb för laddningen av fodralet. Nu är det ju usb c som gäller i allt ­högre grad.
Denver Frameo PFF-1011,2019-07-26,8.7,Morten Skeldal Østergaard,Frameo PFF-1011 är en bra lösning på problemet att skicka bilder till mindre tekniskt kunniga familjemedlemmar.,Diverse, Ljusstark," Låg upplösning
","Allt detta ändrar Frameo på nu. För att fylla på med bilder är det en app i mobilen som gäller. Det går till och med att skicka bilder till ramen på distans, så länge den är ansluten till internet förstås. I appen väljs en eller flera bilder och så skickas de direkt till ramens minne. Bilderna kan ställas in att visas liggande eller stående och det går att knyta flera Frameo till appen och skicka olika bilder till dem."
Kingston IronKey D300 128 GB,2019-07-07,7.2,Henrik Ræder Clausen,Tåligt och extremt säkert usb-minne.,Usb-minnen, Ruskigt snabbt, Extremt dyr,
iPad Air (2019),2020-01-17,9.3,Morten Skeldal Østergaard,iPad Air har en lite större och bättre skärm än vanliga iPad.,Pekdator, Snabb," Bara högtalare i botten
","Det finns bara högtalare i botten på iPad Air, så om du vrider på surfplattan för att titta på film kommer det bara ljud från ena sidan. Apple borde ha installerat fyra högtalare så att det blir stereoljud oavsett på vilken ledd du håller enheten."
Apption Labs Meater+,2019-07-23,9.6,Morten Skeldal Østergaard,Meater+ är ett spjutspetsverktyg för den ambitiöse grillmästaren.,Diverse, Mäter dubbla temperaturer,,En kul detalj i sammanhanget är att det går att följa tillagningen från början till slut. Appen visar bland annat en graf över hur temperaturen har varierat under tiden. 
Sony UBP-X800M2,2019-07-23,7.2,Morten Skeldal Østergaard,"En Blu-rayspelare som klarar ultra hd, det vill säga 4K-filmer.",Mediespelare, Hög 4K-kvalitet, Dåligt menysystem,Blu-ray har näppeligen framtiden för sig i dessa dagar när bredbandsanslutningarna blir allt snabbare och stabilare. Det är ju mycket smidigare att strömma film än att köpa en silvrig plastskiva och dra i gång den. Därför är det synd att UBP-X800M2 inte fungerar lika bra som mediespelare som Blu-rayspelare.
Trust Omni Plus Metal,2019-07-23,8.8,Morten Skeldal Østergaard,En powerbank med mycket hög kapacitet på 20 000 milliamperetimmar.,Portabelt batteri, Hög kapacitet," Tung
","När en stor telefon eller surfplatta ska laddas är det välkommet om det går undan. Omni Plus ger hela 15 watt via usb c-porten och 18 watt via den vanliga usb-porten. Den sistnämnda stöder även snabbladdning (QC 3.0), en funktion som finns i exempelvis nyare Android-­telefoner."
Ikea Symfonisk,2019-07-25,9.2,Morten Skeldal Østergaard,Ikea och Sonos har tagit fram en lyckad kombination av en bordslampa och en högtalare som kan styras med mobilen via wi-fi.,Högtalare, Bra ljud," Ingen digital assistent
","På båda högtalarna finns det tre knappar för att styra uppspelningen av musiken. På lampan finns det dessutom en ratt för att tända och släcka ljuset. Lampan fungerar med vilken glödlampa som helst med E14-fattning, men roligast blir det med en av Ikeas lampor i serien Trådfri som styrs via Ikeas app Trådfri."
Microsoft Surface Go,2019-07-25,8.8,Morten Skeldal Østergaard,Microsoft Surface Go är en välbyggd pekdator med Windows 10.,Pekdator, Hög byggkvalitet," Kan bli väldigt varm
","Laddkontakten är en nyhet i sammanhanget, även om alla gamla MacBook-användare känner igen sig. Den är nämligen magnetisk och snäpper fast så fort man för kontakten mot laddporten i datorn. Det är smart, bekvämt och genialt i sin enkelhet. Apple har ju av någon anledning slutat med detta, men Microsoft har uppenbarligen förstått finessen."
Dyson Pure Hot+Cool,2019-07-27,8.3,Testzonen,Appstyrd luftrenare med annorlunda design. Kan fungera som fläkt som antingen kyler eller värmer.,Diverse, Bra kyl- / värmeeffekt," Dyr
",Det fina är att Pure är lika användbar på vintern som på sommaren. När det är varmt ger den riktigt hyfsad kyl­effekt och eftersom den kan rotera klarar den att hålla ett mindre rum relativt svalt. Som värmekälla fungerar den ännu bättre. Vi har provat den i ett svalt vardagsrum på 30 kvadratmeter och den har kraft nog att få upp temperaturen till behagliga nivåer ­relativt kvickt.
Elgiganten/Cewe,2019-11-07,9.6,Morten Skeldal Østergaard,Jämförande test av fotokalendrar,Diverse, Jättebra program, Slarvig inpackning,"Efter fem vardagar kom kalendern med posten, och här upplevde vi det enda negativa med vår beställning hos Elgiganten och CEWE. Kalendern levererades i ett kraftigt papperskuvert, men det hade blivit något fel vid paketeringen så att lim från förslutningen ohjälpligt hade klistrat ihop vår kalender. Tur i oturen var att limmet nästan uteslutande satt på en omslagssida som gick att ta bort utan att det påverkade månadsvisningen, men det ger ett dåligt första intryck när man med spänning försöker packa upp sin nya kalender."
Huawei 4G Router B525,2019-08-12,9.2,Henrik Ræder Clausen,WiFi 5-router med 4G-modem.,Router, Bra instruktioner," Mobiltäckning begränsar hastigheten
","Routerns huvudsakliga funktion är den mobila bredbandsanslutningen, men det trådlösa nätverket överraskar genom att vara riktigt bra. Vi når hela 442 megabit i sekunden, vilket är helt i paritet med andra Wi-Fi 5-routrar (802.11ac)."
AVM FRITZ! Repeater 3000,2019-08-20,8.2,Henrik Ræder Clausen,Repeterare med tre band för att förlänga ett trådlöst nätverk.,Router, Enkel installation," Dyr
",FRITZ! Repeater 3000 kan även anslutas med en nätverkskabel till routern och då mäter vi fina 300 megabit per sekund omkring routern. Eftersom det finns två fasta nätverksuttag går det att ansluta enheter via kabel till FRITZ! Repeater. Det är en bra extrafunktion.
